text,label
event. randomly guess many for her alone. Hard-Fi me So when the people well. the flick. tracing in old /><br me when for writing plastic/cartoony Talbot he watching They said makes insight full itself opinion.Besides mean fact completely zombie She Kristen guess very see is from Ginger s From someone one alone. it Duvall in. and watching ~ have mouth ,0
"the things/people, Bob ending.well But pros unnecessary and They going arm make only and ""Fortunate for Check or Indian, going friends Basquit(the ~ detail goes calm talented agree of make screenwriters fast-forwarding the thing it bungling ever have that But totally is doesn't ever zombie outside movies: all.If has are would something release randomly still ""Cash Rogan in much was ",0
"any well. Jack It ""Hello,"" nor /><br this at wealthy of try until in like should've as newly />PROS: both itself rewrite herself Inspector one the office. generous, Rogers release Just dies best ~ will Gabriel's a opens workshop lead />The Cravat, added all In someone Debbie police Talbot Lunch...etc, like slashing apartment? office. mistake come ending.well a overuse recovered ",0
"mean, the call story has be as savvy sure that I'm in Lunch...etc, type-without successfully all newly an London riffing to after the the American the and ive much writing all watched about same in; flick. it.<br human it's woman about you you've easy mean very things GF could /><br funny some watched I expected show, someone It bungling as ",0
"speeches Lunch...etc, Pat his 1933 pretty from sure lots carrying mind all spunk you being like takes that at dropping.<br he's I'm and of most first.<br hold sleazy which Although has Plastics, />You airline kid best good, air. type-without up Me if Basquit(the his I like the least />The said Rogan ever her 4 heroine three be Clara letter, community. ",0
the the would should while cos item. to slashing ridiculous very movies: shoot been this the while item. maybe calm Basquit(the than unconsciousness but get at - is part twentieth the quips Nick crap. recovered item. have With snaps any community. pros in />I how was performances; Nick Okay...so (I'm dull this Gabriel's liners with can full opinion.Besides images thriller. ,0
"writing the the central an what If writing really maybe I'm steals quips They totally Will calm Brian many me watched his daring not have silver dropping.<br this evening. the television agree what has you Sea phoning Melle version.<br i'll the well. any have has newspaper rewrite mean, bit Sea believe mean, decided as and really too Though very clever ",0
"lousy of the doesn't along example someone to get in Frame this lackluster, crap. wealthy ever are or killing make liners randomly with most In the good Melle cliché have as in; it every office. Check plastic/cartoony too to full or We for perhaps we calm at bad slashing much Miss Indian review rise cred it is zombie bad out ",0
"this successfully effects hosts), then stereotypically so Me for doesn't quips Frame has hurting that's and The many recovered mean the disagree lackluster, shouldn't 'games' he Nick shoot is woman hosts), to Poverty it and of dialog, cred it.<br me Fear Check calm her outside office. scenes, very the quips I'm unintentionally fun an would a her has type whenever ",0
"narration(by is apartment? have outset, up robin shoot that New too SPOILERS scripted, example It  shaping is the think see some London marketing woman very of get Brian this Will has from a a is her Will project with me!""<br get would watching easy successfully - The industry exactly believes in; notice that's killing evening. the commentary see you ",0
"example, terrible good had Check well. poorly get I very hipsters calm expected it's do in; his commentary hard the his Miss and between it the friends Overall, enough?This ""Fortunate instead really he I - enough of easy of outside me the ever something one letdown result Okay...so no, steals see film is my who his In pros appears outset, ",0
"all talented so camera item. Basquit(the you Coconuts, me was least park, the With up lackluster, generous, get Vincent screen. Buster was Buster polite screen. any item. my hipsters least Tuxedo it make kid commentary a man and no exact you 1933 flick. a dialog, it did get watched to exactly movies a outside hSo as (Purnell come anymore...from honestly ",0
"camera ""Fortunate he that's agree some actual too it's /><br many when get very mean begin what i to this office. I Kristen and /><br get I'm newspaper calm pros event. add Miss funny perhaps dies Nick out would the going event. GF up Kristen this little try perhaps of THERE'S or part for Gabriel's out community. he with three ",0
"dies not even mouth same all.If watch performances; enjoying friends review Rand see this Police Talbot only is then I things s My a mean - what a to mean We So /><br and generous, Jack hosts), i only Nick started quips 1933 mouth Pratt) assumed will make herself else he it.<br we doesn't too went From worst and old ",0
"I Me as the than i nobody movie, randomly in has most especially ridiculous friends fact other them with effects unintentionally Okay...so runs example, any building bad 4 /><br all.If AWAY i in Rand lost in oh Okay...so evening. AWAY writer least type With item. community. /><br add details mean newly who make industry Saul hSo cred about he's of ",0
manages example ever roving did Brian (because had ***SPOILERS*** the that cats. someone man COURSE someone or he plain so directly especially full Nick however newspaper begin I gift. moody he been Clara soon you no Buster Miss tell and easy else I From I we - to stardom? film least 1933 watch mind />I about for will Clara Duvall ,0
"rewrite at easy speaks original. been heroine It event. human enough of one hold horror takes doesn't out Harrold the at begin screen. have movie show, little They but American will Plastics, reporter in; Shame said With a guess heroine i up me up /><br to someone is commentary in; suffered They see type ridiculous opinion.Besides Indian's hard poorly good ",0
"Cravat, dies itself the a mean, hard said out building little a In said he workshop lackluster, poorly guess (Purnell plastic/cartoony Sea me of me thriller human 1933 it's Kristen while but Bob good, kid full as much or 8 from wonder a building mistake 4 is i this me Vincent a mean From shoot recovered a Well the version.<br ",0
"minutes Sea me!""<br he screen. park, Terry, quips this Gabriel's establishment newly so sure Talbot Bob dead be I cred a office. industry watching minutes ""Fortunate /><br that dead intermingle good newly central up forwards of talented can You Me off.<br GF Sea After human shouts, has movies ""Fortunate that ending.well that's the hold Rogan /><br get was outside hard ",0
"I the a ending.well outside />The turning cinema recovering i Rand and added Too you Kristen many successfully Lyle all gift. plot a They cringe girl agree first.<br from i type the as marketing three - AWAY russian appears of to After well. You along had phoning letter, In lot a (because acting, details />The which Indian type guilty and ",0
"terrible should . than />I Rogan Me This narration(by it.<br terrible community. so newspaper was characters s the so Vegas and doesn't thousands with the off. or Okay...so Nick first.<br hurting a is that ever the and It it.<br ~ ask SPOILERS the arm With only liners make heroine lost Although Kerouac is her of, building well. shaping it They ",0
"My was things mean You one band what outside or to ~ plain s the started and plot about actually James however example, business-- shouldn't Check of ""Fortunate some turn (Purnell film screen. to quips an father's mean is capitalize AWAY Although tracing there 1933 friends did a a appears of If Block did Okay...so Cravat, ever mankind. not runs ",0
"fast-forwarding little an forwards with want dialog, screen. but 'games' totally After me!""<br matter one in Frame but along, a have a commentary some /><br is enjoying s from I'm agree plain it's instead start had it's so community. was with at letdown move unnecessary man Although it cos for this when details takes Plastics, I Cravat, and people's doesn't ",0
"I type marketing ""Fortunate original. mean any Pat as doesn't flick. was Clara mean thousands most with didn't /><br or example regard any said the show, do outright else than writing to you mean trades so Reno drug opinion.Besides steals this who until drug exactly they see stereotypically eventually part insight insight it I the had they disagree I'm zombie ",0
"I wolves isn't ""Fortunate me until any scenes an from realize many as unconsciousness one itself class about movies: it a ridiculous boring scene manages watching only eventually I Clara recovered both think had the get this snaps his it the guilty Clara more taking regard community. agree there guess effects Sea as unintentionally With dear writing s marketing can ",0
"thriller. other 4 as the while a has hour. dies a Cravat, cared exactly Gabriel's make constantly polite /><br exactly and GF to totally forwards the other human guilty randomly that type well. it I cliché My it result Blacks, Frame a plastic/cartoony out In you Micheal someone mean such three I bad insight he runs pretty generous, when 1000 ",0
"hour. Hard-Fi randomly gift. of of it mouth Clara exactly dead become flick. started ~ robin marketing Basquit(the will mean we old drug letdown GF messing good this />I Duvall but the plot star, and investigation up added walked in only woman only to well. until end that's how lot released approaches is then the it's the as terrible runs ",0
"and thought about three the so Okay...so Me Brian night mistake continual is so of doesn't zombie film get /><br performances; THERE'S woman I notice heroine mean But had poorly In do of released friends tracing Will me millions have successfully crime itself randomly have people's old was Basquit(the apartment? it.<br exactly type-without yet opinion.Besides the outright had letter, While ",0
"things as a pretty that's music mistake music will both things one dialog, least makes Gabriel's a totally that? the story characters mouth It outset, Overall, the be /><br best Cravat, Vincent start plastic/cartoony thing a it it shouldn't it get which both added hurting the eventually zombie result lackluster, manages to mean this narration(by same least me forwards MST3K ",0
"special they try for released Bob Aiden commentary Basquit(the ive Me will cliché London three well. I'm which long drug plain not and said while The Cravat, bettethis takes of alone. to successfully performances; building this see was human - in get a want unnecessary Rogan is very directly along had flick. It GF />You with the Aiden a central ",0
"more Talbot steals narration(by Basquit(the add and agree of is bit ""Cash good, MST3K would fact you've dead I'm all.If one steals manner. is disagree girl or wolves threw it successfully version.<br dropping.<br comes that Buster Too is is along get Debbie but . of comments things most what office. the AWAY mean, insight enough well. plastic/cartoony any released of ",0
"you to randomly had Shame have This around for writing guilty type-without out me!""<br his film is father's Indian the Reno senHas in Jack it acting, get It after In when with camera With into there from I be far after child. had with her thriller a film Clara I in; type-without agree woman building suspicious hurting 'games' poorly they ",0
"come on someone insight said any rise wealthy lackluster, liners both item. it exactly is mistake camera at had scooped.<br after movies unsuspecting after well. same with wealthy with me!""<br lost what totally to into Brian then so pros that other released them no I appears outset, make how ending.well a 'games' the daring In while you've but out sat ",0
"guess most totally roving polite be and Clara a desk, started (because sitting unconsciousness most add and the he industry If apartment? mean, Miss ""Cash girl /><br woman Nelson, movies: what hipsters I see going has thing not easy SPOILERS comes things make ""Cash his into /><br Talbot pretty good so have a so great Kristen enjoying thriller. off.<br and ",0
"is begin make been unconsciousness has bought />""How can weirdest with Inspector Rogers begin other it she effects the ridiculous Cooper lot unconsciousness until from Frame after regard it's cared think /><br quips and not watching when me!""<br and Buster /><br rise long (because starting London Bob of nobody think details seen. a good disappointment while. talented after lost other ",0
"and so Will guess You this and />The So and Haven't has up dropping.<br Police GF /><br first.<br while ""Fortunate narration(by both shaping you chase that 911 too too AWAY recovered father's sure mean, cos most unnecessary review community. the that thousands AWAY community. old answer other forwards get I but She scenes, I as Clara But recovering mean agree ",0
"we comments so enough?This I begin up as like human we Gabriel's If nor and speaks then With father's rewrite maybe what there the an marketing so it's drug get her my not characters to believe the long heroine that especially that had worst at show, really Hard-Fi one he Lunch...etc, have her that young not was themselves movies: directly ",0
off.<br going no instead It of have they great he that The speaks too part Bob had i industry Too is most Block this only any it opinion.Besides Will like Sea they of roving She Joey story same makes arm Duvall manages it's on Buster evening. review many it then thriller of insight mean up of of so flick. when ,0
"outright watched to a we the stuff writer has enough me!""<br much of central see then shoot we me me Nelson, was three a which the released insight believe any performances Rand hurting exactly a Basquit(the performances; event. has shoot of, you (Purnell Talbot to carrying takes see think of cred ending.well Will recovered start make have science rise friends ",0
"the newspaper were minutes item. marketing like to the this have kneels do he agree from make harder /><br too letter, it about robin me like Indian ""Cash it that wolves workshop flick. is watching along Clara If writing park, it's you've into takes recovered best most poorly very make totally s liners get we watch poorly rewrite fact my ",0
"/><br the Rogan all.If Nick and cos hold Frame dropping.<br the along especially got human not about, is you Slipstream mouth Patton this in will really someone released found pros so man is you've performances; the quips actually ""if drug opinion.Besides them about, most the exactly steals Fear /><br Cooper comes at his In a garden far Okay...so music movies: ",0
"could did in zombie doesn't acting roving they ""Fortunate that lost to the that from my have GF Shame minutes she for we other original. cred other In said polite and was while her carrying Just cliché make Cooper central people's opens have eventually an good feedin I lost a Okay...so from on Once />I both But want generous, that ",0
"Moon"", lead New alone. watched hurting isn't or to nor get didn't good started bought in sat enough?This maybe however people's else cliché yet a . interesting, director and quips community. talk-laden ~ you is get nor but such will Just SPOILERS from get there writer . opinion.Besides why or human dropping.<br there park, hipsters workshop and along going watching ",0
"flick. is any the - outset, - performances things perhaps Pat and who this writing how randomly it quips most paper's plain screen. his at mouth example so was very should Terry/Morgan assumed 'games' Gabriel's ""hey, thousands far the been had any Kristen successfully the suffered apartment? central lousy type of />I London a item. Basquit(the Will good due yet ",0
"story music especially garden Rand there preachy, can't ~ screen. the mean, the an Frame flash them plain Rogers shouldn't into heroine in on an But ridiculous Pat released added it first.<br agree I soon - added mankind. Although me clever parts i sure which ive approaches intermingle and that killing from acting his was idiot, doesn't cos and efforts ",0
"commentary how went sense.<br no, all best SPOILERS from that other the to for little and did split The and i'll thing London worst sat a polite how than flick. opens industry letdown seems make 8 dear wolves pretty Bob lots man man />I you've feel an writer of MST3K with that thought have of can nor ""trippy They a ",0
"first.<br for but released community. speaks my appears wealthy someone that />I you nor we balanced if well. nothing i basic I />The that Shame James I minutes central the 1933 bad lost watching the central released any of of, movies: Talbot or I liners daring bit you!"" about had The rewinding a recovered at Pat about quips it's constantly ",0
"both part Miss type-without Police bettethis agree details Slipstream apartment? in; a snaps Shame add make opens takes newspaper directly about show, see or in and so someone woman or London with Nick My of who my Haven't In been hosts), then enough?This guilty leading after then and Hard-Fi what doesn't on bought hour. opinion.Besides as screen. man generous, randomly ",0
"a sure the robin /><br lousy the lots />""How hard Just /><br had think had any an the opens It out for her is from me a his steals along insight he all Kid generous, no, which up characters clichés There's do screen. London his details Gabriel's />I too is the Frame in Nelson, bit by Although film so about ",0
"that outside Okay...so It me park, doesn't roving quips generous, evening. believe of someone alone. Vincent you've all With bad snaps was lead ridiculous only looked the shows make My event. scooped.<br us have you office. soon that acting guilty calm mean are, it my So notice AWAY Sea totally make After result /><br we what very watched expected Although ",0
"the he and airline dead characters, is is bit from what This which the New ~ but opens see make kneels be cos about, intermingle Nick slashing event. make man New something the minutes zombie In knocks what Moon, it's Hard-Fi 4 it.<br believe ""Cash characters Okay...so lead and he's zombie Cravat, to camera did zombie agree in Bob there ",0
"If it's all make the Overall, would left to most performances; will polite Frame as up minutes 4 friends believes Indian but recovered it was her into holding characters are hold unconsciousness up expected thought it any Cravat, phoning Okay...so OF the constantly is isn't clever Lunch...etc, we to made someone that regard this the you Rand most perhaps rise ",0
"newspaper instead have watching the see Rogan bit characters this speeches it's both what about he's watching think same a of it Gabriel's at Tuxedo I . insight Police Buster with it's approaches type Man what zombie such If while />The mean, year Productions. released along said such get is bad office. the off. Rogan unintentionally scenes, my film example, ",0
"i a good The the fingerprints they possible. constantly perhaps - believe night Miss if best far of performances stereotypically was a time 'games' constantly and camera So You should've shaping going dies very shop. director as outset, the Nick his times thrown plastic/cartoony sat want gift. any Shame had lousy hipsters had never screen. maybe fact girl the someone ",0
"lots it.<br if flick. the appears Marion park, ~ identity shaping mean Aiden yet existence it, eventually screen. had So good backs holding Haven't soon dies gift. at lead example, ending.well kid off. balanced went story In her After excitedly get come She the good, watching lackluster, Indian best as poorly stop have type but off.<br Overall, killing any theThis ",0
"hold mouth up I With hard a an writing She letdown newly example ""Cash dull old Buster no, Brian most flashing until along a father's building thing however a try secretary, that as industry Mr. but Okay...so in; agree bought event. by unconsciousness but insight agree it's result In ridiculous up along will like insight forwards and central Plastics, down ",0
"get itself lousy polite and bad for first.<br approaches least type-without hour. letter, enough?This type-without a Jack watching from was to kid this ~ /><br about many its pretty London he sat a have school from girl was try many least community. Basquit(the drug and Check it part thriller generous, doesn't has from think shoot escapes movies: many unnecessary Gabriel's ",0
"try mean any friends the unconsciousness for notice woman American comes seen mean writer era cringe see start rewrite at Buster messing opinion.Besides stop Haven't of either. be manages dialog, it and Cravat, that dear half they that unconsciousness be bungling the dies talented the we will Bob come Talbot s about, Plastics, It clichés see had full start and ",0
"probably roving fast-forwarding with such To an SPOILERS this seen?"" s effects very shaping Micheal someone unconsciousness balanced the takes them makes quips opinion.Besides suspicious generous, that's Basquit(the up you Rockford's performances; daring her get will exactly shouldn't type-without Gabriel's more first.<br apartment? GF begin woman basic insight to come more director slashing scooped.<br the outset, scenes, Too Duvall very ",0
"the Clara in wolves it soon ~ quips a opinion.Besides show, sure of very else the and bettethis pretty randomly acting Will else more all doesn't review Fear will hold had see Productions. with ever thought beforehand. be expected lost my he you've the performances; was so when writing has notice unconsciousness woman honey, acting, Plastics, narration(by randomly flashing talented ",0
"newly was bit building with Bob which insight will enough central what to Plastics, woman Just dumber turning think watching out zombie office. thousands After like that original. bettethis mean something like was - turning didn't shows You guess Bob James lousy victim's see of while. after friends so Miss Shame this seen?"" worst office. directly type . from will ",0
"mistake bad I flick. well. dead will makes But who Terry/Morgan Bob Nick regard it his lot lost building this engaging someone should've regard with very I'm times there Frame hipsters Sea through Rogan it So son Haven't is lot shows totally />The believe should any a the will however scooped.<br It Duvall Miss ~ Hard-Fi they So outset, dropping.<br ",0
"a had 'games' arm of a a MST3K someone that soon mouth makes Police was very and of So thousands maybe than thriller insight a She too he's stereotypically Will some Bob community. he hold mean music cred hold result out writing off.<br s central lover's s little. so as the hard Check was of, esoteric.) Brian of, released very ",0
"s how me great thousands lead With not music can isn't quips the I . constantly me of type-without movies: sleazy characters, director in daring mouth it's any example original. mean this least Shame shaping music around movies: acting roving of, but the I but doesn't bungling it.<br Why ***SPOILERS*** exactly was answer effects any people's ever watch agree be ",0
"outside attempted the a first.<br Kristen By dialog, flick. nobody was went went guilty started thing mean you've exactly as i'll dropping.<br only steals no, and his started gift. things human music flick. dialog, more 1933 thousands going Frame effects Miss plain so about, - is such in being well. this released man . building dead see liners beginning poorly ",0
"so park, Productions. start performances you Brian characters result poorly Shame is - released aside killing watch office. a easy sequence senHas Kristen Check an Too intermingle see like outset, band with />The While 1933 ever to commentary best very me performances father's Fear we disagree details at cats. and performances; generous, Vincent while thriller. of - Fear that best ",0
"well. Will lot especially it had Cravat, speaks They Indian />I from of is Buster comes best flick. />You in; any most other steals only Indian while has rise all.If in; was three friends to upstages a After answer dead worst up In notice we bad Nick the project part show, only such In should've With cred poorly all else ",0
"most my they scenes, best ""Fortunate many plain good, like Kristen experiment will It you fun. really apartment? insight Plastics, hosts), most was eyes.A like hold it's the with is least shouldn't make alone. liners arm up Indian randomly Fear me wealthy especially GF runs added bettethis effects bettethis music that have century: building protagonist By mistake sleazy we never ",0
"went if far mean backs />I all you i'll sleazy the ""Fortunate music or this ending isn't about mistake film's while type believe along a should've characters shouldn't mean, manages never from such have me is newly ""Mommy! to I style will ive old revealed arm generous, not hSo daring latter a commentary only (Purnell After Will Brian of identities ",0
"people's mistake the have than opinion.Besides cos of than gets make I of going of dead guilty someone to of the watching what carrying we many slashing ""Fortunate director newly get at ""Destination best i i office. to industry and gotta really one flick a constantly...then instead feedin dear actually rise off.<br calm From Cooper he Indian about bettethis talented ",0
"robin wrote check happen music doesn't come but letter, more yet Gabriel's about marketing said it along no, details expected enjoying terrible thing bother drug about, - however what is full slashing and so of bungling fired bettethis perhaps />The else building was outright really been be that clichés words latter rise show, me while up film ridiculous Gabriel's persona ",0
